Degree Name,Guaranteed ATAR score,Prerequisite,Assumed knowledge,Mode,Campus,Study as,Duration,Start date,Degree URL
Bachelor of Biomedical and Health Sciences majoring in Medical Science,80.0,None,None,On Campus,Adelaide City,Full time or part time,3 year(s) full-time,"February, July",https://adelaideuni.edu.au/study/degrees/bachelor-of-biomedical-and-health-sciences-medical-science/dom/
Bachelor of Dental Surgery,,"Any one of SACE Stage 2 Chemistry, Mathematical Methods, Specialist Mathematics, or Physics (or equivalent); PLUS Any one additional subject chosen from SACE Stage 2 Biology, Earth and Environmental Science, Chemistry, or Physics (or equivalent).",High proficiency in written and spoken English,On Campus,Adelaide City,Full-time only (no part time option),5 year(s) full-time only (no part time option),February,https://adelaideuni.edu.au/study/degrees/bachelor-of-dental-surgery/dom/
Bachelor of Laboratory Medicine (Honours),80.0,"Any one of SACE Stage 2 Physics, Biology or Chemistry (or equivalent).",None,On Campus,Adelaide City,Full time or part time,4 year(s) full-time,"February, July",https://adelaideuni.edu.au/study/degrees/bachelor-of-laboratory-medicine-honours/dom/
Bachelor of Medical Studies,,Any one of SACE Stage 2 Biology or Chemistry or Mathematical Methods (or equivalent).,High proficiency in written and spoken English.,On Campus,Adelaide City,Full-time only (no part time option),3 year(s) full-time only (no part time option),February,https://adelaideuni.edu.au/study/degrees/bachelor-of-medical-studies/dom/
Bachelor of Oral Health,,Any 20-credit SACE Stage 2 Tertiary Admission Subject from the Mathematics or Science Learning Areas.,High proficiency in written and spoken English.,On Campus,Adelaide City,Full-time only (no part time option),3 year(s) full-time only (no part time option),February,https://adelaideuni.edu.au/study/degrees/bachelor-of-oral-health/dom/
