Degree Name,Guaranteed ATAR score,Prerequisite,Assumed knowledge,Mode,Campus,Study as,Duration,Start date,Degree URL
"Bachelor of Business (Tourism, Events and Hospitality Management)",,None,None,100% Online,,Full time or part time,3 year(s) full-time,"January, April, June, September",https://adelaideuni.edu.au/study/degrees/online/bachelor-of-business-tourism-events-and-hospitality-management/dom/
Bachelor of Business majoring in Sport Management,70.0,None,None,On Campus,Adelaide City,Full time or part time,3 year(s) full-time,"February, July",https://adelaideuni.edu.au/study/degrees/bachelor-of-business-sport-management/dom/
"Bachelor of Business majoring in Tourism, Events and Hospitality Management",70.0,None,None,On Campus,Adelaide City,Full time or part time,3 year(s) full-time,"February, July",https://adelaideuni.edu.au/study/degrees/bachelor-of-business-tourism-events-and-hospitality-management/dom/
Bachelor of Creative Arts majoring in Festivals,70.0,None,None,On Campus,"Adelaide City, Magill",Full time or part time,3 year(s) full-time,"February, July",https://adelaideuni.edu.au/study/degrees/bachelor-of-creative-arts-festivals/dom/
Bachelor of Exercise and Sport Science,80.0,None,None,On Campus,Adelaide City,Full time or part time,3 year(s) full-time,"February, July",https://adelaideuni.edu.au/study/degrees/bachelor-of-exercise-and-sport-science/dom/
Bachelor of Human Movement majoring in Sport Coaching,70.0,None,None,On Campus,Adelaide City,Full time or part time,3 year(s) full-time,February,https://adelaideuni.edu.au/study/degrees/bachelor-of-human-movement-sport-coaching/dom/
Bachelor of Outdoor and Environmental Leadership,70.0,None,None,On Campus,Adelaide City,Full time or part time,3 year(s) full-time,"February, July",https://adelaideuni.edu.au/study/degrees/bachelor-of-outdoor-environment-leadership/dom/
